titulo_del_producto,descripcion_del_producto,identificador_del_listing,sku_del_vendedor,fecha_de_creacion
TUBOPLUS Goma Fija-Grip DE Color Rosa para Sujetar EL Grip U OVERGRIP Y NO TENGAS LA Necesidad DE Poner LA Cinta Aislante!!,"GOMA FIJA-GRIP DE COLORES PARA SUJETAR EL GRIP U OVERGRIP Y NO TENGAS LA NECESIDAD DE PONER LA CINTA AISLANTE. ¡PERSONALIZA TU RAQUETA TENIS O PALA DE PADEL! Objetivos de la Goma Fija-Gris: 1. Nunca más se te soltará el grip. 2. Localiza rápido tu raqueta. 3. Ajusta tu Grip u Overgrip para que no se suelte. 4. No coloques más la cinta aislante, con la Goma Fija-Gris tienes asegurado el agarre de tu Grip. 5. Diferencia tu pala de las demás. 6. Dale un toque moderno y de color a la pala. 7. Conjunta tu pala con las zapatillas.",0831QCUN6TW,1T-ZK3F-CWMR,2016-08-31 16:55:27+00:00
TUBOPLUS 29PSI X3e con Bomba - Presurizador de Pelotas de Pádel y Tenis | Capacidad para 3 Pelotas | Bote Hermético | Incluye Inflador con Manómetro,"Recupera la presión de tus pelotas con máxima precisión El Tubo Plus 29PSI X3e con Bomba te ofrece una solución completa para conservar el rebote y la presión de 3 pelotas. Su diseño compacto y portátil lo hace ideal para entrenamientos y competiciones. 📌 Incluye bomba de aire con manómetro, permitiéndote ajustar la presión hasta 29 PSI con precisión. Beneficios clave: ✔ Capacidad para 3 pelotas, optimizando espacio y comodidad. ✔ Bomba de aire con manómetro incluida, ajuste de presión personalizado. ✔ Cierre hermético sin fugas, evitando pérdidas de aire. ✔ Compatible con todas las marcas de pelotas de pádel y tenis. ✔ Diseño premium en ABS ultraresistente. Instrucciones de uso: 1️⃣ Introduce las pelotas en el tubo. 2️⃣ Cierra la tapa asegurando un sellado hermético. 3️⃣ Usa la bomba de aire incluida para presurizar hasta 29 PSI. 4️⃣ Almacena el presurizador en un lugar seco hasta el próximo uso.",0314FMA9H2J,29PSIX3_CB_2,2025-03-14 02:46:22+00:00
TUBOPLUS 29PSI X3e - Presurizador de Pelotas de Pádel y Tenis | Capacidad para 3 Pelotas | Bote Hermético | Requiere Bomba de Aire (No Incluida),"Mantén tus pelotas de pádel y tenis siempre a punto Con el Tubo Plus 29PSI, tus pelotas de pádel y tenis mantendrán su rebote y presión original durante mucho más tiempo. Gracias a su sistema de presurización avanzado, evita que las bolas pierdan elasticidad, permitiéndote ahorrar en pelotas nuevas y mejorar tu experiencia de juego. 📌 Disponible en dos versiones: ✔ X3e: Capacidad para 3 pelotas, diseño compacto y fácil de transportar. ✔ X4e: Capacidad para 4 pelotas, ideal para entrenamientos intensivos. 💡 IMPORTANTE: Este producto requiere una bomba de aire compatible con su válvula para presurizar las pelotas (los modelos con bomba ya incluyen inflador con manómetro). 📌 Instrucciones de uso: 1️⃣ Coloca las pelotas dentro del tubo (3 o 4 según el modelo). 2️⃣ Cierra la tapa asegurándote de que el sellado es correcto. 3️⃣ Conecta una bomba de aire compatible con la válvula. 4️⃣ Infla hasta alcanzar una presión de 29 PSI (usando el manómetro si tu modelo lo incluye). 5️⃣ Guarda el presurizador en un lugar fresco y seco hasta el próximo uso.",0314FM6DHKK,29PSIX3_SB,2025-03-14 02:46:22+00:00
TUBOPLUS 29PSI X4e con Bomba - Presurizador de Pelotas de Pádel y Tenis | Capacidad para 4 Pelotas | Bote Hermético | Incluye Inflador con Manómetro,"El presurizador más completo para entrenamientos de alto nivel El Tubo Plus 29PSI X4e con Bomba es la solución definitiva para conservar la presión y el rebote de 4 pelotas de pádel y tenis. Su bomba de aire con manómetro incluida permite ajustar la presión hasta 29 PSI, garantizando el mejor rendimiento en cada partido. 📌 Incluye bomba de aire con manómetro, permitiéndote personalizar la presión de las pelotas según tus necesidades. Beneficios clave: ✔ Capacidad para 4 pelotas, perfecto para entrenamientos intensivos. ✔ Bomba de aire con manómetro incluida, ajuste preciso de la presión. ✔ Cierre hermético sin fugas, evitando pérdidas de aire. ✔ Compatible con todas las marcas de pelotas de pádel y tenis. ✔ Diseño premium en ABS ultraresistente. Instrucciones de uso: 1️⃣ Introduce las pelotas en el tubo. 2️⃣ Cierra la tapa asegurando un sellado hermético. 3️⃣ Usa la bomba de aire incluida para presurizar hasta 29 PSI. 4️⃣ Almacena el presurizador en un lugar seco hasta el próximo uso. Beneficios clave: ✔ Capacidad para 4 pelotas, perfecto para entrenamientos intensivos. ✔ Bomba de aire con manómetro incluida, ajuste preciso de la presión. ✔ Cierre hermético sin fugas, evitando pérdidas de aire. ✔ Compatible con todas las marcas de pelotas de pádel y tenis. ✔ Diseño premium en ABS ultraresistente. Instrucciones de uso: 1️⃣ Introduce las pelotas en el tubo. 2️⃣ Cierra la tapa asegurando un sellado hermético. 3️⃣ Usa la bomba de aire incluida para presurizar hasta 29 PSI. 4️⃣ Almacena el presurizador en un lugar seco hasta el próximo uso.",0314FMACM5G,29PSIX4_CB,2025-03-14 02:46:22+00:00
TUBOPLUS 29PSI X4e - Presurizador de Pelotas de Pádel y Tenis | Capacidad para 4 Pelotas | Bote Hermético | Requiere Bomba de Aire (No Incluida),"Mayor capacidad para entrenamientos más exigentes El Tubo Plus 29PSI X4e permite conservar la presión de hasta 4 pelotas, ofreciendo una solución ideal para jugadores que entrenan con más bolas y buscan maximizar su rendimiento. 📌 Este modelo requiere una bomba de aire compatible con su válvula (no incluida) para restaurar la presión óptima en las pelotas. Beneficios clave: ✔ Capacidad para 4 pelotas, ideal para entrenamientos intensivos. ✔ Cierre hermético sin fugas, manteniendo la presión estable. ✔ Ahorra en pelotas nuevas y mejora tu rendimiento. ✔ Compatible con todas las marcas de pelotas de pádel y tenis. ✔ Diseño premium en ABS ultraresistente. Instrucciones de uso: 1️⃣ Introduce las pelotas en el tubo. 2️⃣ Cierra la tapa asegurando un sellado hermético. 3️⃣ Conecta una bomba de aire compatible y presuriza hasta 29 PSI. 4️⃣ Almacena el presurizador en un lugar seco hasta el próximo uso.",0314FM7XOTM,29PSIX4_SB,2025-03-14 02:42:11+00:00
TUBOPLUS X3 - Presurizador de Pelotas de Pádel y Tenis | Bote Hermético para Mantener la Presión y Recuperar el Rebote | Capacidad para 3 Pelotas | No Incluye Inflador de Aire - Color Dorado,"¿Tus pelotas pierden rebote demasiado rápido? El Tubo Plus X3 es un bote hermético presurizador diseñado para recuperar y mantener la presión de hasta 3 pelotas de pádel o tenis, prolongando su vida útil hasta 4 veces más. Juega siempre con pelotas como nuevas, sin necesidad de renovarlas constantemente. Este modelo requiere el uso de una bomba de aire o inflador compatible (no incluida) para alcanzar la presión ideal de 29 PSI. Su diseño compacto y premium en ABS ultraresistente lo hace perfecto para llevarlo en tu bolsa y proteger las pelotas de golpes y fugas de aire. Beneficios clave: ✔ Mantiene la presión interna y el rebote óptimo. ✔ Evita pelotas blandas y sin elasticidad. ✔ Compatible con todas las marcas de pelotas de pádel y tenis. ✔ Ideal para jugadores que buscan ahorro, rendimiento y durabilidad. Instrucciones de uso: 1️⃣ Coloca hasta 3 pelotas dentro del tubo. 2️⃣ Cierra la tapa asegurando el cierre hermético. 3️⃣ Conecta una bomba de aire estándar y presuriza hasta 29 PSI. 4️⃣ Guarda el bote en un lugar seco hasta tu próximo partido.",0717BMAETTH,4R-VSV0-WZ9Z,2024-07-17 11:38:37+00:00
TUBOPLUS Reposición Junta TÓRICA para TuboX3 y TuboX3 Crystal Ball Pressurizers,"Recambio del elemento más importante de los presurizadores de 3 pelotas de La Marca TuboPlus. ¡¡NO ES COMPATIBLE CON OTROS PRESURIZADORES QUE NO SEAN DE LA MARCA TUBOPLUS!! Sustituye la JUNTA TÓRICA según el uso, recomendamos CAMBIARLA 1 VEZ AL AÑO. Asegura la presurización al 100% cambiando la junta de tu TuboPlus cada año. TUBOPLUS: Nº 1 por 3 años consecutivos 2017, 2018 y 2019. TUBOX3 ES EL ÚNICO PRESURIZADOR A LA VENTA EN TODAS LAS GRANDES CADENAS DE TIENDAS DE ESPAÑA E INTERNACIONALMENTE. LAS JUNTAS TÓRICAS SE ENCUENTRAN EN LA VIDA COTIDIANA en equipos para impedir el intercambio de líquidos o gases en las uniones entre piezas desmontables. Las juntas tóricas necesitan un mantenimiento adecuado. ALGUNAS RECOMENDACIONES PARA SU USO SON LAS SIGUIENTES:",1229PERKNEW,ES-C9YX-7X8Y,2015-12-29 14:19:01+00:00
Tubo Plus X3 - Presurizador de Pelotas de Pádel y Tenis | Bote Hermético para Mantener la Presión y Recuperar el Rebote | Capacidad para 3 Pelotas | No Incluye Inflador de Aire - Color Naranja," ""¿Tus pelotas pierden rebote demasiado rápido? El Tubo Plus X3 es un bote hermético presurizador diseñado para recuperar y mantener la presión de hasta 3 pelotas de pádel o tenis, prolongando su vida útil hasta 4 veces más. Juega siempre con pelotas como nuevas, sin necesidad de renovarlas constantemente. Este modelo requiere el uso de una bomba de aire o inflador compatible (no incluida) para alcanzar la presión ideal de 29 PSI. Su diseño compacto y premium en ABS ultraresistente lo hace perfecto para llevarlo en tu bolsa y proteger las pelotas de golpes y fugas de aire. Beneficios clave: ✔ Mantiene la presión interna y el rebote óptimo. ✔ Evita pelotas blandas y sin elasticidad. ✔ Compatible con todas las marcas de pelotas de pádel y tenis. ✔ Ideal para jugadores que buscan ahorro, rendimiento y durabilidad. Instrucciones de uso: 1️⃣ Coloca hasta 3 pelotas dentro del tubo. 2️⃣ Cierra la tapa asegurando el cierre hermético. 3️⃣ Conecta una bomba de aire estándar y presuriza hasta 29 PSI. 4️⃣ Guarda el bote en un lugar seco hasta tu próximo partido.""",0105QZERMKW,IB-IKLG-TV8H,2016-05-01 09:39:34+00:00
Tubo Plus X3 - Presurizador de Pelotas de Pádel y Tenis | Bote Hermético para Mantener la Presión y Recuperar el Rebote | Capacidad para 3 Pelotas | No Incluye Inflador de Aire - Color Azul,"¿Tus pelotas pierden rebote demasiado rápido? El Tubo Plus X3 es un bote hermético presurizador diseñado para recuperar y mantener la presión de hasta 3 pelotas de pádel o tenis, prolongando su vida útil hasta 4 veces más. Juega siempre con pelotas como nuevas, sin necesidad de renovarlas constantemente. Este modelo requiere el uso de una bomba de aire o inflador compatible (no incluida) para alcanzar la presión ideal de 29 PSI. Su diseño compacto y premium en ABS ultraresistente lo hace perfecto para llevarlo en tu bolsa y proteger las pelotas de golpes y fugas de aire. Beneficios clave: ✔ Mantiene la presión interna y el rebote óptimo. ✔ Evita pelotas blandas y sin elasticidad. ✔ Compatible con todas las marcas de pelotas de pádel y tenis. ✔ Ideal para jugadores que buscan ahorro, rendimiento y durabilidad. Instrucciones de uso: 1️⃣ Coloca hasta 3 pelotas dentro del tubo. 2️⃣ Cierra la tapa asegurando el cierre hermético. 3️⃣ Conecta una bomba de aire estándar y presuriza hasta 29 PSI. 4️⃣ Guarda el bote en un lugar seco hasta tu próximo partido.",0718BP3BZW6,MD-R60M-OYR1,2024-07-18 12:07:45+00:00
TUBOPLUS X3 - Presurizador de Pelotas de Pádel y Tenis | Bote Hermético para Mantener la Presión y Recuperar el Rebote | Capacidad para 3 Pelotas | No Incluye Inflador de Aire - Color Rosa,"¿Tus pelotas pierden rebote demasiado rápido? El Tubo Plus X3 es un bote hermético presurizador diseñado para recuperar y mantener la presión de hasta 3 pelotas de pádel o tenis, prolongando su vida útil hasta 4 veces más. Juega siempre con pelotas como nuevas, sin necesidad de renovarlas constantemente. Este modelo requiere el uso de una bomba de aire o inflador compatible (no incluida) para alcanzar la presión ideal de 29 PSI. Su diseño compacto y premium en ABS ultraresistente lo hace perfecto para llevarlo en tu bolsa y proteger las pelotas de golpes y fugas de aire. Beneficios clave: ✔ Mantiene la presión interna y el rebote óptimo. ✔ Evita pelotas blandas y sin elasticidad. ✔ Compatible con todas las marcas de pelotas de pádel y tenis. ✔ Ideal para jugadores que buscan ahorro, rendimiento y durabilidad. Instrucciones de uso: 1️⃣ Coloca hasta 3 pelotas dentro del tubo. 2️⃣ Cierra la tapa asegurando el cierre hermético. 3️⃣ Conecta una bomba de aire estándar y presuriza hasta 29 PSI. 4️⃣ Guarda el bote en un lugar seco hasta tu próximo partido.",0130AC0TAY7,TUBOX3-PINK,2023-01-30 16:29:42+00:00
Tubo Plus X3 - Presurizador de Pelotas de Pádel y Tenis | Bote Hermético para Mantener la Presión y Recuperar el Rebote | Capacidad para 3 Pelotas | No Incluye Inflador de Aire - Color Blanco,"¿Tus pelotas pierden rebote demasiado rápido? El Tubo Plus X3 es un bote hermético presurizador diseñado para recuperar y mantener la presión de hasta 3 pelotas de pádel o tenis, prolongando su vida útil hasta 4 veces más. Juega siempre con pelotas como nuevas, sin necesidad de renovarlas constantemente. Este modelo requiere el uso de una bomba de aire o inflador compatible (no incluida) para alcanzar la presión ideal de 29 PSI. Su diseño compacto y premium en ABS ultraresistente lo hace perfecto para llevarlo en tu bolsa y proteger las pelotas de golpes y fugas de aire. Beneficios clave: ✔ Mantiene la presión interna y el rebote óptimo. ✔ Evita pelotas blandas y sin elasticidad. ✔ Compatible con todas las marcas de pelotas de pádel y tenis. ✔ Ideal para jugadores que buscan ahorro, rendimiento y durabilidad. Instrucciones de uso: 1️⃣ Coloca hasta 3 pelotas dentro del tubo. 2️⃣ Cierra la tapa asegurando el cierre hermético. 3️⃣ Conecta una bomba de aire estándar y presuriza hasta 29 PSI. 4️⃣ Guarda el bote en un lugar seco hasta tu próximo partido.",0130ABVFN6K,TUBOX3-WHI,2023-01-30 16:29:42+00:00
TUBOPLUS - Bote presurizador para Pelotas de pádel y Tenis | TUBOX4 Crystal (SIN Bomba) | Compresor para Pelotas | Accesorios indispensables,"Sumérgete en una experiencia de juego inigualable con el presurizador padel TUBOPLUS. Diseñado meticulosamente para los apasionados del pádel y el tenis, este innovador dispositivo revoluciona la forma en que experimentas cada partido. El presurizador pelotas padel TUBOPLUS está diseñado para maximizar la durabilidad y el rendimiento de tus pelotas de pádel y tenis. Con un proceso sencillo, restaura la presión interna y disfruta de un rebote constante y preciso. Mantén la emoción de cada partido al máximo y experimenta la satisfacción de jugar con pelotas que siempre están en su mejor estado. Un diseño apto para todo tipo de bolas padel: pelotas padel adidas, pelotas padel bullpadel, pelotas padel head pro, pelotas padel dunlop, pelotas de padel wilson, pelotas padel babolat, pelotas de padel. Además de mejorar el rendimiento, el TUBOPLUS también es un camino hacia el ahorro a largo plazo. Evita la compra frecuente de nuevas pelotas y aprovecha al máximo cada una de ellas. Contribuye al medio ambiente al reducir el desperdicio y al mismo tiempo, ahorra dinero en tu pasatiempo favorito. ¿Preocupado por la compatibilidad con tus pelotas? El TUBOPLUS es tu solución universal. Diseñado para acomodar pelotas de pádel y tenis de todas las marcas, es una respuesta a tus inquietudes. Sin necesidad de bombas adicionales ni habilidades técnicas, el proceso es sencillo y rápido. Recupera la confianza en tus pelotas con el TUBOX3 CRYSTAL. Su diseño transparente te permite observar cómo las pelotas recuperan su presión óptima. La transparencia de su diseño te permite estar seguro de que estás listo para cada partido con pelotas en las mejores condiciones. El TUBOPLUS no solo mejora el rendimiento de las pelotas, sino que también contribuye a un juego más seguro. Reduce el riesgo de lesiones al mantener un rebote consistente y controlado.",0130ABZ2X8Q,TUBOX4-CRY-SB,2023-01-30 16:29:42+00:00
TUBOPLUS - TuboX4 Crystal + Bomba con Manómetro - Presurizador de Pelotas de Tenis y Padel,"TuboX4 Crystal mantiene y recupera la presión de las pelotas de tenis y padel para tenerlas perfectas entre partido y partido. Gracias a su válvula de alta gama es posible inyectar aire en el interior del cilindro y aumentar la presión, permitiendo recuperar completamente las pelotas. Fácil de usar y resistente. Tiene capacidad para botes de 3 y 4 pelotas, pero también funciona con menos.",1031VUJD0TH,UG-965T-RORR,2019-10-31 12:47:35+00:00
REPOSICIÓN Junta TÓRICA para TUBOX4,"Recambio del elemento más importante de los presurizadores de 4 pelotas de la Marca TuboPlus. ¡¡NO ES COMPATIBLE CON OTROS PRESURIZADORES QUE NO SEAN DE LA MARCA TUBOPLUS!! Sustituye la JUNTA TÓRICA según el uso, recomendamos CAMBIARLA 1 VEZ AL AÑO. Asegura la presurización al 100% cambiando la junta de tu TuboPlus cada año. TUBOPLUS: Nº 1 por 4 años consecutivos 2017, 2018, 2019 y 2020. TUBOPLUS ES LA ÚNICA MARCA DE PRESURIZADORES A LA VENTA EN TODAS LAS GRANDES CADENAS DE TIENDAS DE ESPAÑA E INTERNACIONALMENTE. LAS JUNTAS TÓRICAS SE ENCUENTRAN EN LA VIDA COTIDIANA en equipos para impedir el intercambio de líquidos o gases en las uniones entre piezas desmontables. Las juntas tóricas necesitan un mantenimiento adecuado.",0611XPV85MQ,XH-D7NU-I2MU,2020-11-06 08:26:33+00:00
TUBOPLUS 29PSI - Presurizador de Pelotas de Pádel y Tenis | Mantiene la Presión y el Rebote | Bote Hermético para Alargar la Vida Útil de Las Pelotas,"Mantén tus pelotas de pádel y tenis siempre a punto Con el Tubo Plus 29PSI, tus pelotas de pádel y tenis mantendrán su rebote y presión original durante mucho más tiempo. Gracias a su sistema de presurización avanzado, evita que las bolas pierdan elasticidad, permitiéndote ahorrar en pelotas nuevas y mejorar tu experiencia de juego. 📌 Disponible en dos versiones: ✔ X3E: Capacidad para 3 pelotas, diseño compacto y fácil de transportar. ✔ X4E: Capacidad para 4 pelotas, ideal para entrenamientos intensivos. 💡 IMPORTANTE: Este producto requiere una bomba de aire compatible con su válvula para presurizar las pelotas (los modelos con bomba ya incluyen inflador con manómetro). 📌 Instrucciones de uso: 1️⃣ Coloca las pelotas dentro del tubo (3 o 4 según el modelo). 2️⃣ Cierra la tapa asegurándote de que el sellado es correcto. 3️⃣ Conecta una bomba de aire compatible con la válvula. 4️⃣ Infla hasta alcanzar una presión de 29 PSI (usando el manómetro si tu modelo lo incluye). 5️⃣ Guarda el presurizador en un lugar fresco y seco hasta el próximo uso.",0314FM68YIO,29PSI_PARENT,2025-03-14 02:05:14+00:00
"TUBOPLUS Bomba de Aire Manual de Aluminio, 27 cm, Manómetro 360°, Compatible Schrader/Presta, 80 PSI, Azul","Descubre la bomba de aire manual TuboPlus de 27 cm, una herramienta premium diseñada para ofrecer máxima eficiencia y precisión. Fabricada en aleación de aluminio de alta calidad, cuenta con un innovador manómetro de 38 mm que gira 360 grados para una lectura óptima desde cualquier ángulo. Su cabezal automático patentado es compatible con válvulas Schrader y Presta, eliminando la necesidad de adaptadores adicionales. El mango ergonómico en forma de T facilita el inflado, permitiendo alcanzar una presión máxima de 80 PSI (5,52 BAR). Esta bomba versátil es perfecta para bicicletas y equipamiento deportivo, combinando durabilidad con facilidad de uso. Su diseño elegante en color azul y su construcción robusta garantizan un rendimiento consistente. Ideal para ciclistas y deportistas que buscan una solución confiable para mantener la presión adecuada en sus equipos. La longitud de 27 centímetros proporciona un equilibrio ideal entre potencia y portabilidad.",0718FEIC3QL,Long Pump,2025-07-18 09:34:10+00:00
"Bomba de Aire Manual con Manómetro 22cm – Alta Presión 80 PSI – Compatible Schrader/Presta – Aluminio Premium – para Bicicletas, Balones, Fútbol, Baloncesto","La bomba de aire manual de 22 cm de BETO es la combinación perfecta de portabilidad y potencia. Con una estructura en aluminio de alta calidad y un manómetro de 360° que garantiza precisión desde cualquier ángulo, es ideal tanto para ciclistas como para deportistas. Gracias a su cabezal automático, es compatible con válvulas Schrader y Presta sin necesidad de adaptadores. Su diseño permite inflar balones de fútbol, baloncesto, voleibol y rugby, convirtiéndola en un accesorio esencial para cualquier aficionado o profesional del deporte. Compacta, ligera y duradera: una bomba premium para llevar a todas partes.",0718FEI3TGW,Short_Pump,2025-07-18 09:28:31+00:00
TUBOPLUS - TuboX4 Crystal + Bomba con Manómetro - Presurizador de Pelotas de Tenis y Padel,"Si tus pelotas de pádel y tenis pierden presión después de pocos partidos, el presurizador TUBOPLUS con bomba de aire y manómetro es la solución ideal. Gracias a su sistema de cierre hermético y su bomba incorporada, puedes ajustar la presión hasta 30 PSI y mantener las bolas en condiciones óptimas por mucho más tiempo. 🔹 Presión ajustable con bomba manual y manómetro para un rebote perfecto. 🔹 Sistema hermético avanzado que evita fugas de aire y conserva la presión interna. 🔹 Ahorro garantizado, prolongando la vida útil de las pelotas hasta 4 veces más. 🔹 Diseño universal, compatible con todas las marcas y tipos de pelotas de pádel y tenis. Juega con pelotas siempre listas para la competición y ajusta la presión a tu medida. ¡Domina la pista con un rebote perfecto en cada golpe!",0718FEUVCNF,X4CRY_CB,2025-07-18 10:48:28+00:00
TUBOPLUS - Bote presurizador para Pelotas de pádel y Tenis | TUBOX4 Crystal | Compresor para Pelotas | Accesorios indispensables (X4 sin Bomba),"Si tus pelotas de pádel y tenis pierden presión después de pocos partidos, el presurizador TUBOPLUS con bomba de aire y manómetro es la solución ideal. Gracias a su sistema de cierre hermético y su bomba incorporada, puedes ajustar la presión hasta 30 PSI y mantener las bolas en condiciones óptimas por mucho más tiempo. 🔹 Presión ajustable con bomba manual y manómetro para un rebote perfecto. 🔹 Sistema hermético avanzado que evita fugas de aire y conserva la presión interna. 🔹 Ahorro garantizado, prolongando la vida útil de las pelotas hasta 4 veces más. 🔹 Diseño universal, compatible con todas las marcas y tipos de pelotas de pádel y tenis. Juega con pelotas siempre listas para la competición y ajusta la presión a tu medida. ¡Domina la pista con un rebote perfecto en cada golpe!",0718FEG09TG,X4Crystal_SB,2025-07-18 09:45:42+00:00
TUBOPLUS X3 - Presurizador de Pelotas de Pádel y Tenis | Bote Hermético para Mantener la Presión y Recuperar el Rebote | Capacidad para 3 Pelotas | No Incluye Inflador de Aire - Color Dorado,No description,0402F9KXPAC,amzn.gr.4R-VSV0-WZ9Z-Ta_1Vy_o1Bf4Y8Hm-LN,2025-02-04 09:19:27+00:00
TUBOPLUS - Bote presurizador para Pelotas de pádel y Tenis | TUBOX4 Crystal (SIN Bomba) | Compresor para Pelotas | Accesorios indispensables,No description,0402F9LWKP3,amzn.gr.TUBOX4-CRY-SB-8qsTjCHh-850KrB-LN,2025-02-04 09:22:07+00:00
